[
  {
    "company": "Alibaba",
    "theme": "Unified optimizer, vector, lineage, and SQL visibility",
    "adoptable_idea": "Connect query execution, vector search, lineage, and code-to-SQL visibility into one metadata fabric.",
    "key_papers": [
      {
        "title": "Learned Query Optimizer in Alibaba MaxCompute: Challenges, Analysis, and Solutions",
        "url": "https://arxiv.org/abs/2602.07336",
        "type": "primary / arXiv",
        "source_url": "https://arxiv.org/abs/2602.07336",
        "last_verified": "2026-06-29",
        "source_type": "arxiv",
        "venue_or_track": "arXiv",
        "doi_or_arxiv": "arXiv:2602.07336",
        "claim_scope": "paper metadata"
      },
      {
        "title": "LindormVector: A Distributed Vector Engine on a Cloud-Native Multi-Model NoSQL Database",
        "url": "https://2026.sigmod.org/sigmod_industry_papers.shtml",
        "type": "SIGMOD 2026 Industry listing",
        "source_url": "https://2026.sigmod.org/sigmod_industry_papers.shtml",
        "last_verified": "2026-06-29",
        "source_type": "sigmod_industry_listing",
        "venue_or_track": "SIGMOD 2026 Industry",
        "doi_or_arxiv": "",
        "claim_scope": "accepted-paper listing"
      },
      {
        "title": "SQLens: Continuous Code-to-SQL Visibility in the Wild",
        "url": "https://2026.sigmod.org/sigmod_industry_papers.shtml",
        "type": "SIGMOD 2026 Industry listing",
        "source_url": "https://2026.sigmod.org/sigmod_industry_papers.shtml",
        "last_verified": "2026-06-29",
        "source_type": "sigmod_industry_listing",
        "venue_or_track": "SIGMOD 2026 Industry",
        "doi_or_arxiv": "",
        "claim_scope": "accepted-paper listing"
      },
      {
        "title": "NebulaSQL: A Large-scale Feature Computation System for Online Recommendation",
        "url": "https://2026.sigmod.org/sigmod_industry_papers.shtml",
        "type": "SIGMOD 2026 Industry listing",
        "source_url": "https://2026.sigmod.org/sigmod_industry_papers.shtml",
        "last_verified": "2026-06-29",
        "source_type": "sigmod_industry_listing",
        "venue_or_track": "SIGMOD 2026 Industry",
        "doi_or_arxiv": "",
        "claim_scope": "accepted-paper listing"
      }
    ],
    "why_it_matters": "A useful repository database should answer not only “what files exist?” but also “which code produced this SQL, which query produced this table, which vector index serves this search?”",
    "repo_db_translation": "Store `graph_edges`, `lineage`, `query_runs`, `vector_index`, and `code_to_sql_edges` as connected concepts.",
    "first_schema_objects": [
      "query_runs",
      "lineage_edges",
      "vector_index_entries",
      "code_to_sql_edges",
      "optimizer_observations"
    ],
    "do_now": "Log every generated SQL statement with source file, function/symbol, input artifact, execution plan, output artifact, and cost.",
    "do_later": "Use historical executions and repository context to rank candidate plans and queries.",
    "watch_out": "Vector search without lineage becomes hard to debug; lineage without query runs becomes hard to trust.",
    "priority": "P0"
  },
  {
    "company": "ByteDance",
    "theme": "Repository as production-scale graph and multimodal warehouse",
    "adoptable_idea": "Represent code, docs, schemas, tests, proofs, embeddings, and execution traces as graph-connected multimodal objects.",
    "key_papers": [
      {
        "title": "ByteHouse: ByteDance’s Cloud-Native Data Warehouse for Real-Time Multimodal Data Analytics",
        "url": "https://arxiv.org/abs/2602.08226",
        "type": "primary / arXiv",
        "source_url": "https://arxiv.org/abs/2602.08226",
        "last_verified": "2026-06-29",
        "source_type": "arxiv",
        "venue_or_track": "arXiv",
        "doi_or_arxiv": "arXiv:2602.08226",
        "claim_scope": "paper metadata"
      },
      {
        "title": "ByteGraph-Dione: An Adaptive Dual-Format Graph Engine with Hotspot Awareness and Transaction Efficiency for Production-Scale Workloads",
        "url": "https://2026.sigmod.org/sigmod_industry_papers.shtml",
        "type": "SIGMOD 2026 Industry listing",
        "source_url": "https://2026.sigmod.org/sigmod_industry_papers.shtml",
        "last_verified": "2026-06-29",
        "source_type": "sigmod_industry_listing",
        "venue_or_track": "SIGMOD 2026 Industry",
        "doi_or_arxiv": "",
        "claim_scope": "accepted-paper listing"
      },
      {
        "title": "G2+D: A High Performance Distributed Graph Mining System",
        "url": "https://2026.sigmod.org/sigmod_industry_papers.shtml",
        "type": "SIGMOD 2026 Industry listing",
        "source_url": "https://2026.sigmod.org/sigmod_industry_papers.shtml",
        "last_verified": "2026-06-29",
        "source_type": "sigmod_industry_listing",
        "venue_or_track": "SIGMOD 2026 Industry",
        "doi_or_arxiv": "",
        "claim_scope": "accepted-paper listing"
      }
    ],
    "why_it_matters": "Large repositories are not just folders. They are multimodal graphs: code calls code, docs describe APIs, tests verify behavior, schemas constrain data, embeddings support retrieval.",
    "repo_db_translation": "Model `file`, `symbol`, `doc`, `schema`, `test`, `proof`, and `embedding` as graph nodes with typed edges.",
    "first_schema_objects": [
      "repo_nodes",
      "graph_edges",
      "multimodal_chunks",
      "execution_traces",
      "embedding_runs"
    ],
    "do_now": "Create typed nodes and edges for files, symbols, imports, tests, docs, schemas, and embeddings.",
    "do_later": "Add graph-mining jobs for hotspot files, central APIs, dead edges, and risky dependency clusters.",
    "watch_out": "A graph without stable IDs becomes noisy. Anchor nodes to stable file/symbol IDs and content hashes.",
    "priority": "P0"
  },
  {
    "company": "Databricks",
    "theme": "Generated artifacts as materialized views",
    "adoptable_idea": "Treat generated files, summaries, diagrams, JSONL, TSV, and Mermaid outputs as materialized views over source repository state.",
    "key_papers": [
      {
        "title": "Enzyme: Incremental View Maintenance for Data Engineering",
        "url": "https://arxiv.org/abs/2603.27775",
        "type": "primary / arXiv",
        "source_url": "https://arxiv.org/abs/2603.27775",
        "last_verified": "2026-06-29",
        "source_type": "arxiv",
        "venue_or_track": "arXiv",
        "doi_or_arxiv": "arXiv:2603.27775",
        "claim_scope": "paper metadata"
      },
      {
        "title": "Enzyme: Incremental View Maintenance With Spark Declarative Pipelines",
        "url": "https://2026.sigmod.org/sigmod_industry_papers.shtml",
        "type": "SIGMOD 2026 Industry listing",
        "source_url": "https://2026.sigmod.org/sigmod_industry_papers.shtml",
        "last_verified": "2026-06-29",
        "source_type": "sigmod_industry_listing",
        "venue_or_track": "SIGMOD 2026 Industry",
        "doi_or_arxiv": "",
        "claim_scope": "accepted-paper listing"
      }
    ],
    "why_it_matters": "A repository with generated artifacts needs freshness, dependency tracking, and refresh plans. Materialized-view thinking gives a clean model for rebuilds.",
    "repo_db_translation": "`generated/*.tsv`, `*.jsonl`, `*.mmd`, and generated docs should have source hashes, refresh plans, stale flags, and incremental refresh metadata.",
    "first_schema_objects": [
      "generated_artifacts",
      "artifact_dependencies",
      "refresh_plans",
      "refresh_runs",
      "stale_flags"
    ],
    "do_now": "Record source file hashes for every generated artifact and mark artifacts stale when dependencies change.",
    "do_later": "Add an incremental refresh planner that refreshes only affected artifacts rather than rebuilding everything.",
    "watch_out": "Without lineage, generated docs silently drift from the source repository.",
    "priority": "P0"
  },
  {
    "company": "Google",
    "theme": "Long-lived key-value / wide-column metadata design",
    "adoptable_idea": "Optimize metadata identity for decades: stable keys, versioned paths, immutable content hashes, and forward-compatible columns.",
    "key_papers": [
      {
        "title": "Twenty Years of Bigtable",
        "url": "https://research.google/pubs/twenty-years-of-bigtable/",
        "type": "primary / Google Research",
        "source_url": "https://research.google/pubs/twenty-years-of-bigtable/",
        "last_verified": "2026-06-29",
        "source_type": "google_research",
        "venue_or_track": "Google Research",
        "doi_or_arxiv": "",
        "claim_scope": "paper metadata"
      },
      {
        "title": "Twenty Years of Bigtable",
        "url": "https://2026.sigmod.org/sigmod_industry_papers.shtml",
        "type": "SIGMOD 2026 Industry listing",
        "source_url": "https://2026.sigmod.org/sigmod_industry_papers.shtml",
        "last_verified": "2026-06-29",
        "source_type": "sigmod_industry_listing",
        "venue_or_track": "SIGMOD 2026 Industry",
        "doi_or_arxiv": "",
        "claim_scope": "accepted-paper listing"
      }
    ],
    "why_it_matters": "Repository metadata is historical by nature. Paths move, files rename, schemas evolve, and hashes remain the best anchor for content identity.",
    "repo_db_translation": "Use `file_id`, `path`, `sha256`, `version`, `valid_from`, `valid_to`, and `path_history` so metadata remains stable across renames and rebuilds.",
    "first_schema_objects": [
      "files",
      "file_versions",
      "path_history",
      "content_hashes",
      "metadata_cells"
    ],
    "do_now": "Separate logical file identity from mutable path and immutable content hash.",
    "do_later": "Partition metadata by repository, time, and content-hash prefix for large-scale scans.",
    "watch_out": "Do not use path as the only primary key. Paths are names, not identities.",